{
  "version": "1.0.0",
  "adapter": "velinstyle",
  "skills": [
    { "id": "velin-design-hero-compose", "name": "Hero Compose", "category": "design", "priority": "core", "status": "beta", "confidence": "high", "origin": "official", "capabilities": ["build", "review"], "estimatedComplexity": "medium", "estimatedTokens": 1200, "dependsOn": ["velin-dev-plan-first"], "requiresCli": ["plan", "scaffold", "review"], "requiresMeta": true, "compatibility": { "framework": { "min": "1.2.0", "max": "2.x" }, "cli": { "min": "1.2.0" }, "agent": { "min": "1.0.0" }, "skillEngine": { "min": "1.0.0" } }, "optimizedFor": ["cursor", "vscode", "claude-code", "windsurf"], "inputs": ["prompt", "html", "screenshot"], "outputs": ["html", "review-json"], "onlyIf": ["project.hasHtml"], "hooks": { "beforeRun": null, "afterRun": null, "onSuccess": null, "onFailure": null }, "telemetry": { "recommended": true, "deprecated": false, "replacement": null }, "description": "Composes first viewport hero following VelinStyle hierarchy and CTA constraints.", "prosePath": "skills/velin-design-hero-compose/SKILL.md" },
    { "id": "velin-design-section-rhythm", "name": "Section Rhythm", "category": "design", "priority": "recommended", "status": "beta", "confidence": "high", "origin": "official", "capabilities": ["build"], "estimatedComplexity": "medium", "estimatedTokens": 900, "dependsOn": ["velin-design-hero-compose"], "requiresCli": ["scaffold"], "requiresMeta": true, "compatibility": { "framework": { "min": "1.2.0", "max": "2.x" }, "cli": { "min": "1.2.0" }, "agent": { "min": "1.0.0" }, "skillEngine": { "min": "1.0.0" } }, "optimizedFor": ["cursor", "vscode"], "inputs": ["prompt", "html"], "outputs": ["html", "checklist"], "onlyIf": ["project.hasHtml"], "hooks": { "beforeRun": null, "afterRun": null, "onSuccess": null, "onFailure": null }, "telemetry": { "recommended": true, "deprecated": false, "replacement": null }, "description": "Aligns spacing rhythm and section purpose to design rules.", "prosePath": "skills/velin-design-section-rhythm/SKILL.md" },
    { "id": "velin-design-surface-roles", "name": "Surface Roles", "category": "design", "priority": "recommended", "status": "beta", "confidence": "medium", "origin": "official", "capabilities": ["build", "theme"], "estimatedComplexity": "low", "estimatedTokens": 700, "dependsOn": [], "requiresCli": ["review"], "requiresMeta": true, "compatibility": { "framework": { "min": "1.2.0", "max": "2.x" }, "cli": { "min": "1.2.0" }, "agent": { "min": "1.0.0" }, "skillEngine": { "min": "1.0.0" } }, "optimizedFor": ["cursor", "vscode"], "inputs": ["html", "tokens"], "outputs": ["html", "report"], "onlyIf": ["project.hasTokens"], "hooks": { "beforeRun": null, "afterRun": null, "onSuccess": null, "onFailure": null }, "telemetry": { "recommended": true, "deprecated": false, "replacement": null }, "description": "Maps sections to base/raised/overlay surface roles.", "prosePath": "skills/velin-design-surface-roles/SKILL.md" },
    { "id": "velin-dev-plan-first", "name": "Plan First", "category": "development", "priority": "core", "status": "stable", "confidence": "high", "origin": "official", "capabilities": ["ai-orchestration", "build"], "estimatedComplexity": "low", "estimatedTokens": 500, "dependsOn": [], "requiresCli": ["plan"], "requiresMeta": false, "compatibility": { "framework": { "min": "1.2.0", "max": "2.x" }, "cli": { "min": "1.2.0" }, "agent": { "min": "1.0.0" }, "skillEngine": { "min": "1.0.0" } }, "optimizedFor": ["cursor", "claude-code"], "inputs": ["prompt"], "outputs": ["plan-json"], "onlyIf": [], "hooks": { "beforeRun": null, "afterRun": null, "onSuccess": null, "onFailure": null }, "telemetry": { "recommended": true, "deprecated": false, "replacement": null }, "description": "Creates a plan JSON before implementation to reduce hallucinations.", "prosePath": "skills/velin-dev-plan-first/SKILL.md" },
    { "id": "velin-dev-page-scaffold", "name": "Page Scaffold", "category": "development", "priority": "core", "status": "beta", "confidence": "high", "origin": "official", "capabilities": ["build"], "estimatedComplexity": "medium", "estimatedTokens": 1000, "dependsOn": ["velin-dev-plan-first"], "requiresCli": ["scaffold", "review"], "requiresMeta": true, "compatibility": { "framework": { "min": "1.2.0", "max": "2.x" }, "cli": { "min": "1.2.0" }, "agent": { "min": "1.0.0" }, "skillEngine": { "min": "1.0.0" } }, "optimizedFor": ["cursor", "vscode"], "inputs": ["prompt", "plan-json"], "outputs": ["html", "review-json"], "onlyIf": ["project.hasHtml"], "hooks": { "beforeRun": null, "afterRun": null, "onSuccess": null, "onFailure": null }, "telemetry": { "recommended": true, "deprecated": false, "replacement": null }, "description": "Renders plan-based HTML and runs review gates.", "prosePath": "skills/velin-dev-page-scaffold/SKILL.md" },
    { "id": "velin-dev-component-wire", "name": "Component Wire", "category": "development", "priority": "recommended", "status": "beta", "confidence": "medium", "origin": "official", "capabilities": ["build"], "estimatedComplexity": "medium", "estimatedTokens": 800, "dependsOn": ["velin-components-select-compose"], "requiresCli": ["review"], "requiresMeta": true, "compatibility": { "framework": { "min": "1.2.0", "max": "2.x" }, "cli": { "min": "1.2.0" }, "agent": { "min": "1.0.0" }, "skillEngine": { "min": "1.0.0" } }, "optimizedFor": ["cursor", "claude-code"], "inputs": ["html", "docs"], "outputs": ["html", "diff"], "onlyIf": ["project.hasComponents"], "hooks": { "beforeRun": null, "afterRun": null, "onSuccess": null, "onFailure": null }, "telemetry": { "recommended": false, "deprecated": false, "replacement": null }, "description": "Wires selected components with predictable APIs and semantics.", "prosePath": "skills/velin-dev-component-wire/SKILL.md" },
    { "id": "velin-components-select-compose", "name": "Select Components", "category": "components", "priority": "core", "status": "stable", "confidence": "high", "origin": "official", "capabilities": ["build"], "estimatedComplexity": "low", "estimatedTokens": 650, "dependsOn": [], "requiresCli": ["blueprint"], "requiresMeta": true, "compatibility": { "framework": { "min": "1.2.0", "max": "2.x" }, "cli": { "min": "1.2.0" }, "agent": { "min": "1.0.0" }, "skillEngine": { "min": "1.0.0" } }, "optimizedFor": ["cursor", "windsurf"], "inputs": ["prompt", "docs"], "outputs": ["html", "checklist"], "onlyIf": ["project.hasComponents"], "hooks": { "beforeRun": null, "afterRun": null, "onSuccess": null, "onFailure": null }, "telemetry": { "recommended": true, "deprecated": false, "replacement": null }, "description": "Chooses component set that matches page intent and constraints.", "prosePath": "skills/velin-components-select-compose/SKILL.md" },
    { "id": "velin-components-api-contract", "name": "API Contract", "category": "components", "priority": "recommended", "status": "beta", "confidence": "high", "origin": "official", "capabilities": ["documentation", "review"], "estimatedComplexity": "medium", "estimatedTokens": 900, "dependsOn": ["velin-components-select-compose"], "requiresCli": ["review"], "requiresMeta": true, "compatibility": { "framework": { "min": "1.2.0", "max": "2.x" }, "cli": { "min": "1.2.0" }, "agent": { "min": "1.0.0" }, "skillEngine": { "min": "1.0.0" } }, "optimizedFor": ["cursor", "vscode"], "inputs": ["html", "docs"], "outputs": ["markdown", "report"], "onlyIf": ["project.hasComponents"], "hooks": { "beforeRun": null, "afterRun": null, "onSuccess": null, "onFailure": null }, "telemetry": { "recommended": true, "deprecated": false, "replacement": null }, "description": "Validates component contracts and event/API usage.", "prosePath": "skills/velin-components-api-contract/SKILL.md" },
    { "id": "velin-components-recipe", "name": "Component Recipe", "category": "components", "priority": "recommended", "status": "beta", "confidence": "medium", "origin": "official", "capabilities": ["build", "documentation"], "estimatedComplexity": "low", "estimatedTokens": 700, "dependsOn": ["velin-components-select-compose"], "requiresCli": ["scaffold"], "requiresMeta": true, "compatibility": { "framework": { "min": "1.2.0", "max": "2.x" }, "cli": { "min": "1.2.0" }, "agent": { "min": "1.0.0" }, "skillEngine": { "min": "1.0.0" } }, "optimizedFor": ["cursor"], "inputs": ["prompt", "html"], "outputs": ["html", "markdown"], "onlyIf": ["project.hasComponents"], "hooks": { "beforeRun": null, "afterRun": null, "onSuccess": null, "onFailure": null }, "telemetry": { "recommended": false, "deprecated": false, "replacement": null }, "description": "Builds reusable component recipes for recurring UI blocks.", "prosePath": "skills/velin-components-recipe/SKILL.md" },
    { "id": "velin-components-accessibility-map", "name": "Component Accessibility Map", "category": "components", "priority": "advanced", "status": "beta", "confidence": "medium", "origin": "official", "capabilities": ["accessibility", "documentation"], "estimatedComplexity": "medium", "estimatedTokens": 1100, "dependsOn": ["velin-components-api-contract"], "requiresCli": ["docs"], "requiresMeta": true, "compatibility": { "framework": { "min": "1.2.0", "max": "2.x" }, "cli": { "min": "1.2.0" }, "agent": { "min": "1.0.0" }, "skillEngine": { "min": "1.0.0" } }, "optimizedFor": ["cursor", "claude-code"], "inputs": ["docs", "html"], "outputs": ["markdown", "report"], "onlyIf": ["project.hasComponents"], "hooks": { "beforeRun": null, "afterRun": null, "onSuccess": null, "onFailure": null }, "telemetry": { "recommended": false, "deprecated": false, "replacement": null }, "description": "Maps every chosen component to a11y expectations and test hooks.", "prosePath": "skills/velin-components-accessibility-map/SKILL.md" },